Temporada,Num Programa Temporada,Num Programa Global,Fecha,Tema,Tema Descripcion,Recomendacion Tipo,Recomendacion Titulo,Recomendacion Mas Info,Recomendacion Link,Musica Titulo,Musica Autor,Musica Mas Info,Musica Link,Archivo Audio
5,9,179,7 de Abril de 2022,El Tiempo,Husos horarios y su relación con la Astronomía,Libro,El Tiempo a través del tiempo,"Kristen Lippincott, Umberto Eco, E. H. Gombrich. Editorial Grijalb",,,,,,unaventanaaluniverso/UNA_VENTANA_AL_UNIVERSO_07_04_22.mp3
5,8,178,31 de Marzo de 2022,El Tiempo,,Libro,"Matadero Cinco, La Cruzada de los Niños","Kurt Vonnegut, Editorial Blackie Books",,Marcha Radetzky,Johann Strauss,"Concierto de Año Nuevo 2022. Interpretada por la Orquesta Filarmónica de Viena, dirigida por Daniel Barcinboim.",,unaventanaaluniverso/UNA_VENTANA_AL_UNIVERSO_31_MARZO_2022.mp3
5,7,177,24 de Marzo de 2022,Los Exoplanetas,,Libro,Mundo Anillo,"Larry Niven, Editorial Roca",,"5,000 Exoplanets: Listen to the Sounds of Discovery",NASA Data Sonification,,,unaventanaaluniverso/UNA_VENTANA_AL_UNIVERSO_24_MARZO_2022.mp3
5,6,176,17 de Marzo de 2022,William Herschel,Construyendo los Cimientos del cielo II,Documental,"Cosmos, Capítulo 5",Un cielo repleto de fantasmas,,Sweet Caroline,Neil Diamond,,,unaventanaaluniverso/UNA_VENTANA_AL_UNIVERSO_17_MARZO_2022.mp3
5,5,175,10 de Marzo de 2022,Caroline Herschel,Construyendo los Cimientos del cielo I,Libro,The Construction of the Heavens,William Herschel´s Cosmology. Michael Hoskin. Editorial: Cambridge,,Sinfonía para cuerdas nº 8 en Do menor,William Herschel,,,unaventanaaluniverso/UNA_VENTANA_AL_UNIVERSO_10_MARZO_2022.mp3
4,,153,21 de Agosto de 2019,"Músico y Astrónomo, Sir William Herschel.",,Libro,La construcción de los cielos,"Cosmología de William Herschel. Michael Hoskin, Churchill College, Cambridge. Publicado en Febrero de 2012.SBN: 9781107018389",,Uranus por Sleeping At Last,,,https://www.youtube.com/watch?v=-DJMvtBP4qQ,unaventanaaluniverso/una_ventana_al_universo_21_agto_19.mp3
